{
  "api_version": "slipcage.dev/vm-plan/v1alpha1",
  "kind": "K3sVMPlan",
  "status": "design_only",
  "metadata": {
    "id": "slipcage-k3s-synthetic-lab",
    "revision": 1
  },
  "provenance": {
    "pin_status": "synthetic_fixture",
    "note": "TEST FIXTURE ONLY: fabricated digest strings; NO guest assets exist or are verified."
  },
  "runtime": {
    "architecture": "x86_64",
    "hypervisor": "qemu",
    "acceleration": "kvm",
    "qemu_version": "9.0.0",
    "machine_type": "pc-q35-9.0",
    "cpu_model": "x86-64-v2"
  },
  "software": {
    "guest_kernel_release": "6.8.0-synthetic",
    "k3s_version": "v1.30.1+k3s1",
    "cni": "flannel"
  },
  "artifacts": {
    "os_image_sha256": "a1a1a1a1a1a1a1a1a1a1a1a1a1a1a1a1a1a1a1a1a1a1a1a1a1a1a1a1a1a1a1a1",
    "kernel_sha256": "b2b2b2b2b2b2b2b2b2b2b2b2b2b2b2b2b2b2b2b2b2b2b2b2b2b2b2b2b2b2b2b2",
    "k3s_binary_sha256": "c3c3c3c3c3c3c3c3c3c3c3c3c3c3c3c3c3c3c3c3c3c3c3c3c3c3c3c3c3c3c3c3",
    "cni_assets_sha256": "d4d4d4d4d4d4d4d4d4d4d4d4d4d4d4d4d4d4d4d4d4d4d4d4d4d4d4d4d4d4d4d4",
    "container_images_sha256": "e5e5e5e5e5e5e5e5e5e5e5e5e5e5e5e5e5e5e5e5e5e5e5e5e5e5e5e5e5e5e5e5"
  },
  "guest": {
    "vcpu": 2,
    "ram_mib": 4096,
    "disk_gib": 24,
    "max_runtime_seconds": 900,
    "max_parallel_vms": 1,
    "ephemeral_overlay": true
  },
  "network": {
    "design": "guest_internal_only",
    "host_bridging": false,
    "public_egress": false,
    "provider_metadata_access": false,
    "guest_image_supply": "preloaded_offline",
    "policy_enforcement_proven": false
  },
  "safety": {
    "approved_workload": "benign_rbac_only",
    "arbitrary_commands": false,
    "host_mounts": false,
    "provider_testing": false,
    "vm_execution_enabled": false,
    "network_configuration_enabled": false
  }
}
